{"files":[{"host":"codex","kind":"architect-owner","path":".agents/skills/isotope-architect/SKILL.md","revision":"sha256:adc48738551027380e9f58a7967d6b2d7adf4d3cc54b06f9bc70a3aec3e39881"},{"host":"codex","kind":"operate-owner","path":".agents/skills/isotope-operate/SKILL.md","revision":"sha256:1cc5780d946d83e027000156908d11f17573b85d97db63a9799e80e75b3ae5c6"},{"host":"claude","kind":"acceptance-agent","path":".claude/agents/isotope-acceptance.md","revision":"sha256:08718961e638485be3e333ae885518047368e851656de0508b1e841ba79d8b57"},{"host":"claude","kind":"analyze-agent","path":".claude/agents/isotope-analyze.md","revision":"sha256:a2d39f2b11b42cd3d70d91f41e61eb964ba17cc7020e40f39dabdffb54f36881"},{"host":"claude","kind":"construction-agent","path":".claude/agents/isotope-construction.md","revision":"sha256:efbc7191e8e7ff12263d0e3f119835556b2319631d949cfbe23241565a0baea6"},{"host":"claude","kind":"decision-agent","path":".claude/agents/isotope-decision.md","revision":"sha256:47ce403eb720b460655cfb375586eca073fab5ea7c0b73baf2ed50b1533c6ea2"},{"host":"claude","kind":"design-agent","path":".claude/agents/isotope-design.md","revision":"sha256:e3dc9315870ebee7d75369c82d48cda1c37bc1903bf57069642c343ba2f6eb72"},{"host":"claude","kind":"expression-agent","path":".claude/agents/isotope-expression.md","revision":"sha256:4633d96bb7f42aa484f775a6cbc2f59537b7485d711c83a9dddd5a38e89cc1d8"},{"host":"claude","kind":"intake-agent","path":".claude/agents/isotope-intake.md","revision":"sha256:2261a20886a9eb8bb2fe308fdd1958faead4e7e28321f62f84dcbbdd0da67c7e"},{"host":"claude","kind":"review-agent","path":".claude/agents/isotope-review.md","revision":"sha256:16575eb96b5876dca38852f394781923ee64b7fc9d386482611c9dc000f28755"},{"host":"claude","kind":"architect-owner","path":".claude/skills/isotope-architect/SKILL.md","revision":"sha256:adc48738551027380e9f58a7967d6b2d7adf4d3cc54b06f9bc70a3aec3e39881"},{"host":"claude","kind":"operate-owner","path":".claude/skills/isotope-operate/SKILL.md","revision":"sha256:1cc5780d946d83e027000156908d11f17573b85d97db63a9799e80e75b3ae5c6"},{"host":"codex","kind":"acceptance-agent","path":".codex/agents/isotope-acceptance.toml","revision":"sha256:271c19c3ae1c34ecdaa6083e2d176936038ab2ec50535dafe3e9215af79bfadf"},{"host":"codex","kind":"analyze-agent","path":".codex/agents/isotope-analyze.toml","revision":"sha256:7c4bcd988ca55219972c103e40503905afe32c1b06b25d5a7aabae79f503db40"},{"host":"codex","kind":"construction-agent","path":".codex/agents/isotope-construction.toml","revision":"sha256:571422036bbda4480904914472ed2889e47c04d58a2e2a6bf4c3d381a65d4851"},{"host":"codex","kind":"decision-agent","path":".codex/agents/isotope-decision.toml","revision":"sha256:8de5fc58e122a2d4f9ead9907d125a7b9179fdd86c0f9fa3da278b0ca0d75dba"},{"host":"codex","kind":"design-agent","path":".codex/agents/isotope-design.toml","revision":"sha256:8d5e4b19652c80b64e952332e669b2aa5adb18177734df9238e260299b2b44be"},{"host":"codex","kind":"expression-agent","path":".codex/agents/isotope-expression.toml","revision":"sha256:cc104eec0172587a394661a8ae6623c41de3c8a7a13e79254d7e451890382029"},{"host":"codex","kind":"intake-agent","path":".codex/agents/isotope-intake.toml","revision":"sha256:3f1fb63b8fafd56091c0349aafc017add5d9ad7eca205af00196d0ae2bacf388"},{"host":"codex","kind":"review-agent","path":".codex/agents/isotope-review.toml","revision":"sha256:d64beb6c9327b7f8c9da44b98d7d8c725d807349acabd74d07b6504dbd31f350"},{"host":null,"kind":"shared-cli","path":".isotope/bin/_assets/agents/acceptance/nucleus.md","revision":"sha256:85c45ca6a0dc163db9da24c5470962370cf96a3775e33c4b514729f2f74b05b7"},{"host":null,"kind":"shared-cli","path":".isotope/bin/_assets/agents/analyze/nucleus.md","revision":"sha256:633e5d09c6216105a2546ec4b08089ed94386e03d27a995060037d4d9d7acb81"},{"host":null,"kind":"shared-cli","path":".isotope/bin/_assets/agents/construction/nucleus.md","revision":"sha256:59c46ee4f0e151268e4a128dabdb2097fdd1e633ba321a099c23c91f0834fe5c"},{"host":null,"kind":"shared-cli","path":".isotope/bin/_assets/agents/decision/nucleus.md","revision":"sha256:5b872d3dd41828f090955a6500f33f779d1798974540e56e82862aae5168df97"},{"host":null,"kind":"shared-cli","path":".isotope/bin/_assets/agents/design/nucleus.md","revision":"sha256:2923795e3281f5ef6791ea8e3487c467a7e4e2f618ea8853e97f6ccd8389e12f"},{"host":null,"kind":"shared-cli","path":".isotope/bin/_assets/agents/expression/nucleus.md","revision":"sha256:d3e90edcac80758b1c66221f85f733e34d5298bb70d991549b20941f91e8dc63"},{"host":null,"kind":"shared-cli","path":".isotope/bin/_assets/agents/intake/nucleus.md","revision":"sha256:d2a8fef6b790fa377b1ca999c078430051a095b9b46d16531cba9c3504c05f8e"},{"host":null,"kind":"shared-cli","path":".isotope/bin/_assets/agents/review/nucleus.md","revision":"sha256:da3e6652683e1db32383ea1f13f495d61ed2b1e56ad6fa10bf7a99554e71bf19"},{"host":null,"kind":"shared-cli","path":".isotope/bin/_assets/build.json","revision":"sha256:5ded0f8c69ad80362a0474165dffbb837dfc43fd4d4f0773a73cecbb30ef6df2"},{"host":null,"kind":"shared-cli","path":".isotope/bin/_assets/reactions/acceptance/brief.map.json","revision":"sha256:e907a81ad5f4fb9df6ed517fbb2dce875acac1bfcc098dc41020dcd5f6291e76"},{"host":null,"kind":"shared-cli","path":".isotope/bin/_assets/reactions/acceptance/protocol.json","revision":"sha256:ca4ca79cde436ca32e80258642eb2acf6c7034e3dd8144f1ba929e2ce0bd0869"},{"host":null,"kind":"shared-cli","path":".isotope/bin/_assets/reactions/acceptance/readout.schema.json","revision":"sha256:037c47fce53fcf527f61af97ca057400bee61de3a08d9962b21fbabbd0da4dd6"},{"host":null,"kind":"shared-cli","path":".isotope/bin/_assets/reactions/analyze/brief.map.json","revision":"sha256:fe760799dcd7ec380250476adcb9a3324e0acd894228eaa590dd4a9ccd46c380"},{"host":null,"kind":"shared-cli","path":".isotope/bin/_assets/reactions/analyze/protocol.json","revision":"sha256:2b5c8fc65ae07515b52af22052e54ae10ce4f990166b0f97ec6c03c0597f8eba"},{"host":null,"kind":"shared-cli","path":".isotope/bin/_assets/reactions/analyze/readout.schema.json","revision":"sha256:bd8a616b76dfae880d51403d77b548b1dbcb5deba426569eac1e03f2c201497c"},{"host":null,"kind":"shared-cli","path":".isotope/bin/_assets/reactions/construction/brief.map.json","revision":"sha256:090d19d867dde50200b0a25a9813f2f4d684949fbe66e0449998c0db18111115"},{"host":null,"kind":"shared-cli","path":".isotope/bin/_assets/reactions/construction/protocol.json","revision":"sha256:8018afebd0f879433664d10db2b7bd4128bec35544def2dd23aafdc244bacaff"},{"host":null,"kind":"shared-cli","path":".isotope/bin/_assets/reactions/construction/readout.schema.json","revision":"sha256:4c90a72b19d6ce311f9fa8cc8747d31dae99b4da6b27645cee7ae501d6abda94"},{"host":null,"kind":"shared-cli","path":".isotope/bin/_assets/reactions/decision/brief.map.json","revision":"sha256:9dc7cb474a73f7bc0a5d2f459000f7bcee52b38f7ea2e781ed5fd9b82bdad1e4"},{"host":null,"kind":"shared-cli","path":".isotope/bin/_assets/reactions/decision/protocol.json","revision":"sha256:bd191ecb52326265f9336d01dacfc485365877761fb440567a98785f5b5ec6c3"},{"host":null,"kind":"shared-cli","path":".isotope/bin/_assets/reactions/decision/readout.schema.json","revision":"sha256:658571d9095bc69a3f4efc094b9b30ea37e623fb2e08fc5d80be250f1e72f408"},{"host":null,"kind":"shared-cli","path":".isotope/bin/_assets/reactions/design/brief.map.json","revision":"sha256:8dc051dc46d09dc50fbb3bb09c778ac156ec417a8885624748f1283c7548ee84"},{"host":null,"kind":"shared-cli","path":".isotope/bin/_assets/reactions/design/protocol.json","revision":"sha256:a80404607ad7cb7544cff6f6f6c8fa44fbd9af8cf8095b970d1a7cd92f9f774f"},{"host":null,"kind":"shared-cli","path":".isotope/bin/_assets/reactions/design/readout.schema.json","revision":"sha256:54cb094881736bd089378d85de4541836fd41e556e849e4f661498972de73064"},{"host":null,"kind":"shared-cli","path":".isotope/bin/_assets/reactions/expression/brief.map.json","revision":"sha256:6bcc71adbde35d566235065465749f3e9032b9bde16e3cd4b22cd4e9d1ce5659"},{"host":null,"kind":"shared-cli","path":".isotope/bin/_assets/reactions/expression/protocol.json","revision":"sha256:fcacc601b46e2bad29c9ca7db1f1a8e98619249216a1e736954a39896bb56912"},{"host":null,"kind":"shared-cli","path":".isotope/bin/_assets/reactions/expression/readout.schema.json","revision":"sha256:9e23efc718be8463fca8d23509d5bdb0584b3bc43b45c4f2b76dc5c723992307"},{"host":null,"kind":"shared-cli","path":".isotope/bin/_assets/reactions/index.json","revision":"sha256:a36d054c37ce3bb42e432c9a83210682233ec0cd449e735aeb395c1700d3d37d"},{"host":null,"kind":"shared-cli","path":".isotope/bin/_assets/reactions/intake/brief.map.json","revision":"sha256:19906045a08008a85d25195d0d7b2205c0bb228bd3337792297835180bf91746"},{"host":null,"kind":"shared-cli","path":".isotope/bin/_assets/reactions/intake/protocol.json","revision":"sha256:a4b979fc75222fb5c915595e7dce71bad730c3ec87ffe4186fcd2624809ba9ff"},{"host":null,"kind":"shared-cli","path":".isotope/bin/_assets/reactions/intake/readout.schema.json","revision":"sha256:214f889ee4c1018cf5cd964e370a5cd0710fa0991edfba0fdde7436cbdb3a45c"},{"host":null,"kind":"shared-cli","path":".isotope/bin/_assets/reactions/review/brief.map.json","revision":"sha256:9c1e3007f4b1f8437d2d9d369ba5324510448b835d79052eb5f56b6b4c4d89a3"},{"host":null,"kind":"shared-cli","path":".isotope/bin/_assets/reactions/review/protocol.json","revision":"sha256:f0eb073427e2f1e831c1c924b4434ea4475551423cbde8fe73cd21628a66d8f6"},{"host":null,"kind":"shared-cli","path":".isotope/bin/_assets/reactions/review/readout.schema.json","revision":"sha256:d653a2ee75dd5c3b90a814ffa5b8c0d654d13136eee8a88b0f7f2e2d2bb98733"},{"host":null,"kind":"shared-cli","path":".isotope/bin/_assets/schemas/acceptance.schema.json","revision":"sha256:85a558430ea370a7ad96b6d3a8cb4f3172d22fc06d21dcc4bb1d23edf77dca23"},{"host":null,"kind":"shared-cli","path":".isotope/bin/_assets/schemas/analysis.schema.json","revision":"sha256:af474f299d7a79f5979d4404557cb56d044c74043c46450f3e5ad31ed2ab50cd"},{"host":null,"kind":